{
  "schema_version": "1.0.0",
  "request_id": "REQ-20261010-000001",
  "generated_at": "2026-10-10T18:30:00+05:30",
  "data_cutoff_date": "2026-08-31",
  "customer": {
    "customer_id": "C10001",
    "segment": "SUBURBAN_HOMEOWNER",
    "region": "LONDON",
    "data_completeness": 0.92
  },
  "opportunity": {
    "product_id": "GP01",
    "product_code": "EV_FINANCE",
    "product_name": "EV Finance",
    "category": "TRANSPORT"
  },
  "prediction": {
    "propensity": 0.84,
    "confidence": 0.87,
    "confidence_band": "HIGH",
    "model_version": "ev_propensity_v1.0.0",
    "reason_codes": [
      {
        "code": "HIGH_FUEL_SPEND",
        "label": "High recurring fuel spending",
        "importance": 0.38,
        "evidence": {
          "metric": "average_monthly_fuel_spend",
          "value": 245.5,
          "unit": "GBP",
          "comparison": "ABOVE_SEGMENT_AVERAGE"
        }
      },
      {
        "code": "HIGH_ANNUAL_MILEAGE",
        "label": "High annual vehicle mileage",
        "importance": 0.31,
        "evidence": {
          "metric": "annual_mileage",
          "value": 16500,
          "unit": "miles/year",
          "comparison": "ABOVE_THRESHOLD"
        }
      },
      {
        "code": "EXISTING_ICE_VEHICLE",
        "label": "Currently owns a petrol or diesel vehicle",
        "importance": 0.19,
        "evidence": {
          "metric": "vehicle_fuel_type",
          "value": "PETROL",
          "unit": null,
          "comparison": null
        }
      }
    ]
  },
  "eligibility": {
    "status": "MANUAL_REVIEW",
    "is_eligible": null,
    "rule_version": "ev_eligibility_v1.0.0",
    "decision_codes": [
      {
        "code": "ANNUAL_MILEAGE_MISSING",
        "result": "UNKNOWN",
        "message": "Annual mileage is not available."
      }
    ],
    "failed_rules": [],
    "missing_requirements": [
      "annual_mileage"
    ],
    "requires_human_review": true
  },
  "impact": {
    "status": "INSUFFICIENT_DATA",
    "method_id": "EV_AVOIDED_EMISSIONS_V1",
    "primary_metric": null,
    "supporting_metrics": [],
    "assumptions": [],
    "emission_factors": [],
    "calculation_inputs": {
      "annual_mileage": null,
      "annual_fuel_litres": null,
      "estimated_ev_kwh": null
    }
  },
  "recommendation": {
    "decision": "MANUAL_REVIEW",
    "priority_score": null,
    "priority_band": null,
    "action_code": "REQUEST_MILEAGE_DATA",
    "action_label": "Request mileage information",
    "customer_visible": false,
    "manager_visible": true
  },
  "explanation": {
    "status": "NOT_GENERATED",
    "headline": null,
    "customer_message": null,
    "manager_message": null,
    "verification": {
      "passed": false,
      "verified_fields": [],
      "unsupported_claims": [],
      "fallback_used": false
    },
    "llm": {
      "provider": "OPENAI",
      "model": "MODEL_NAME",
      "prompt_version": "customer_insight_v1.0.0"
    }
  },
  "audit": {
    "pipeline_status": "PARTIAL_SUCCESS",
    "component_versions": {
      "feature_pipeline": "features_v1.0.0",
      "transaction_classifier": "transaction_classifier_v1.0.0",
      "propensity_model": "ev_propensity_v1.0.0",
      "eligibility_rules": "ev_eligibility_v1.0.0",
      "carbon_engine": "carbon_engine_v1.0.0",
      "llm_prompt": "customer_insight_v1.0.0",
      "llm_verifier": "verifier_v1.0.0"
    },
    "warnings": [
      "ILLUSTRATIVE_CONFLICTING_SIGNALS_REVIEW"
    ],
    "errors": [],
    "human_review_required": true
  }
}
