{
  "schema_version": "1.0.0",
  "request_id": "REQ-20261010-000001",
  "generated_at": "2026-10-10T18:30:00+05:30",
  "data_cutoff_date": "2026-08-31",
  "customer": {
    "customer_id": "C10001",
    "segment": "SUBURBAN_HOMEOWNER",
    "region": "LONDON",
    "data_completeness": 0.92
  },
  "opportunity": {
    "product_id": "GP01",
    "product_code": "EV_FINANCE",
    "product_name": "EV Finance",
    "category": "TRANSPORT"
  },
  "prediction": {
    "propensity": 0.84,
    "confidence": 0.87,
    "confidence_band": "HIGH",
    "model_version": "ev_propensity_v1.0.0",
    "reason_codes": [
      {
        "code": "HIGH_FUEL_SPEND",
        "label": "High recurring fuel spending",
        "importance": 0.38,
        "evidence": {
          "metric": "average_monthly_fuel_spend",
          "value": 245.5,
          "unit": "GBP",
          "comparison": "ABOVE_SEGMENT_AVERAGE"
        }
      },
      {
        "code": "HIGH_ANNUAL_MILEAGE",
        "label": "High annual vehicle mileage",
        "importance": 0.31,
        "evidence": {
          "metric": "annual_mileage",
          "value": 16500,
          "unit": "miles/year",
          "comparison": "ABOVE_THRESHOLD"
        }
      },
      {
        "code": "EXISTING_ICE_VEHICLE",
        "label": "Currently owns a petrol or diesel vehicle",
        "importance": 0.19,
        "evidence": {
          "metric": "vehicle_fuel_type",
          "value": "PETROL",
          "unit": null,
          "comparison": null
        }
      }
    ]
  },
  "eligibility": {
    "status": "ELIGIBLE",
    "is_eligible": true,
    "rule_version": "ev_eligibility_v1.0.0",
    "decision_codes": [
      {
        "code": "HAS_EXISTING_VEHICLE",
        "result": "PASS",
        "message": "Customer has an existing vehicle."
      },
      {
        "code": "NOT_EXISTING_EV_OWNER",
        "result": "PASS",
        "message": "No existing electric vehicle was found."
      },
      {
        "code": "MILEAGE_DATA_AVAILABLE",
        "result": "PASS",
        "message": "Annual mileage information is available."
      }
    ],
    "failed_rules": [],
    "missing_requirements": [],
    "requires_human_review": false
  },
  "impact": {
    "status": "AVAILABLE",
    "method_id": "EV_AVOIDED_EMISSIONS_V1",
    "method_name": "Current fuel emissions minus estimated EV electricity emissions",
    "methodology_reference": "GHG_PROTOCOL_AVOIDED_EMISSIONS",
    "time_horizon": {
      "value": 1,
      "unit": "YEAR"
    },
    "primary_metric": {
      "metric": "POTENTIAL_CO2E_AVOIDED",
      "lower_estimate": 900.0,
      "central_estimate": 1050.0,
      "upper_estimate": 1200.0,
      "unit": "kgCO2e/year"
    },
    "supporting_metrics": [
      {
        "metric": "CURRENT_TRANSPORT_EMISSIONS",
        "value": 2850.0,
        "unit": "kgCO2e/year"
      },
      {
        "metric": "ESTIMATED_EV_EMISSIONS",
        "value": 1800.0,
        "unit": "kgCO2e/year"
      }
    ],
    "assumptions": [
      {
        "code": "MILEAGE_UNCHANGED",
        "description": "Annual mileage remains unchanged after switching vehicles."
      },
      {
        "code": "EV_EFFICIENCY_RANGE",
        "description": "EV energy efficiency is represented using a documented range."
      }
    ],
    "emission_factors": [
      {
        "factor_id": "UK_PETROL_2026",
        "activity": "PETROL_COMBUSTION",
        "value": 2.31,
        "unit": "kgCO2e/litre",
        "source": "UK_DESNZ_DEFRA",
        "source_year": 2026,
        "factor_version": "2026.1"
      },
      {
        "factor_id": "UK_GRID_2026",
        "activity": "GRID_ELECTRICITY",
        "value": 0.18,
        "unit": "kgCO2e/kWh",
        "source": "UK_DESNZ_DEFRA",
        "source_year": 2026,
        "factor_version": "2026.1"
      }
    ],
    "calculation_inputs": {
      "annual_mileage": 16500,
      "annual_fuel_litres": 1234.0,
      "estimated_ev_kwh": 10000.0
    },
    "calculation_timestamp": "2026-10-10T18:29:30+05:30"
  },
  "recommendation": {
    "decision": "RECOMMEND",
    "priority_score": 0.73,
    "priority_band": "HIGH",
    "action_code": "EXPLORE_EV_OPTIONS",
    "action_label": "Explore EV options",
    "customer_visible": true,
    "manager_visible": true
  },
  "explanation": {
    "status": "VERIFIED",
    "headline": "An electric vehicle may suit your travel pattern.",
    "customer_message": "Your recurring fuel spending and annual mileage suggest that an electric vehicle may suit your travel pattern. The estimated potential reduction is 900-1,200 kg CO2e per year, based on documented fuel and electricity factors. Explore EV options, subject to eligibility checks.",
    "manager_message": "This customer has high fuel spending, high annual mileage and an existing petrol vehicle. EV Finance passed the configured eligibility rules and should be considered for the next customer conversation.",
    "verification": {
      "passed": true,
      "verified_fields": [
        "product_name",
        "reason_codes",
        "impact_range",
        "impact_unit",
        "action_label",
        "data_cutoff_date"
      ],
      "unsupported_claims": [],
      "fallback_used": false
    },
    "llm": {
      "provider": "OPENAI",
      "model": "MODEL_NAME",
      "prompt_version": "customer_insight_v1.0.0"
    }
  },
  "audit": {
    "pipeline_status": "SUCCESS",
    "component_versions": {
      "feature_pipeline": "features_v1.0.0",
      "transaction_classifier": "transaction_classifier_v1.0.0",
      "propensity_model": "ev_propensity_v1.0.0",
      "eligibility_rules": "ev_eligibility_v1.0.0",
      "carbon_engine": "carbon_engine_v1.0.0",
      "llm_prompt": "customer_insight_v1.0.0",
      "llm_verifier": "verifier_v1.0.0"
    },
    "warnings": [],
    "errors": [],
    "human_review_required": false
  }
}
